{
  "schema_version": "persona_profile.v0",
  "case_id": "D-B04",
  "participant_id": "spouse_A",
  "role_label": "Parent A",
  "public_goals": [
    "Secure a predictable overnight schedule.",
    "Reduce last-minute disruptions for the child.",
    "Protect school-week stability."
  ],
  "private_concerns": [
    "Worries the child becomes dysregulated after irregular exchanges.",
    "Feels the other parent prioritizes flexibility over routine.",
    "Fears being seen as controlling if they press too hard on structure."
  ],
  "red_lines": [
    "Will not agree to a schedule that changes week-to-week without clear notice.",
    "Will not accept frequent school-night overnights unless transportation and homework routines are reliable."
  ],
  "communication_style": {
    "directness": "direct",
    "emotional_expression": "restrained_but_firm",
    "processing_style": "reflective",
    "negotiation_style": "positional_at_opening_but_potentially_problem_solving",
    "verbosity": "concise_to_moderate"
  },
  "emotional_triggers": [
    "Suggestions that routine concerns are just control tactics.",
    "Minimization of the child's school-related needs.",
    "Last-minute schedule changes framed as harmless."
  ],
  "disclosure_tendencies": {
    "baseline": "shares logistics readily",
    "under_stress": "becomes narrower and repeats core points",
    "with_perceived_bias": "withholds flexibility and becomes more defensive"
  },
  "compromise_willingness": {
    "baseline": "medium",
    "if_child_stability_is_taken_seriously": "high",
    "if_pressed_toward_quick_settlement": "low"
  },
  "response_to_perceived_bias_or_pressure": {
    "if_ai_seems_to_favor_other_parent": "becomes cooler, more skeptical, and less willing to explore options",
    "if_ai_pushes_agreement_too_fast": "repeats red lines and questions the process fairness",
    "if_ai_frames_concerns_neutrally": "becomes more open to phased or contingent arrangements"
  },
  "interest_profile": [
    "Child stability",
    "School continuity",
    "Predictability",
    "Reduced conflict exposure for the child"
  ],
  "starting_positions": [
    "Primary position: school-night overnights should remain limited and structured.",
    "Secondary position: any expansion should be gradual and tied to demonstrated reliability."
  ],
  "likely_openings": [
    "The child needs consistency during the school week.",
    "I am not trying to cut anyone out, but the current changes are too disruptive."
  ]
}